{"$schema":"https://json-schema.org/draft/2020-12/schema","type":"object","required":["allowed_mode","execution_manifest_path","execution_manifest_sha256","allowed_config_sha256","reference_sha256","allowed_seeds","max_users","users_per_db","users_per_arm","pairs_per_db","allowed_output_directory","overwrite","production_execution_authorized","production_seed"],"properties":{"allowed_mode":{"const":"calibration"},"execution_manifest_path":{"type":"string"},"execution_manifest_sha256":{"pattern":"^[0-9a-f]{64}$"},"allowed_config_sha256":{"type":"array","items":{"pattern":"^[0-9a-f]{64}$"}},"reference_sha256":{"const":"9120561ee85705141a92eae74c5015fb2c9a20f0c8d1f6df4d99893952fd1e9f"},"allowed_seeds":{"type":"object"},"max_users":{"type":"integer","maximum":2000},"users_per_db":{"enum":[200,2000]},"users_per_arm":{"enum":[100,1000]},"pairs_per_db":{"enum":[100,1000]},"allowed_output_directory":{"type":"string"},"overwrite":{"const":false},"production_execution_authorized":{"const":false},"production_seed":{"const":2434815518}},"additionalProperties":false}

