{"allowed_mode":"calibration","execution_manifest_path":"C:\\Users\\이소이\\Desktop\\[은평4기] AI로 끝내자! 바이브코딩으로 배우는 데이터분석 실전 과정\\미니 프로젝트\\깃허브 업로드용\\sesac-data-analysis-mini-project\\09_단계별 분석\\3단계_10000건_증감_분석\\호텔검색_1만명증강_승인인터페이스수정및교정_260907_1351_01\\호텔검색_1만명증강_실행파일manifest_260907_1351_01.json","execution_manifest_sha256":"f98dc39cb4794c2bbc440051cc626a150c9fa187f8a23f65837a93b899d8939c","allowed_config_sha256":["5db48c55eedaf2ae8850be0b529503182131e70a4259380ccad58ab4811a04e7","b7fc4218aaabbdbc21b035fa97d3aad7933cc93f9e70a0e971fe5666b7a3d569","0995eb89e92e93ddedfdf6c35eabfa915c849170f3790a619a037f592e0cfb4e"],"reference_sha256":"9120561ee85705141a92eae74c5015fb2c9a20f0c8d1f6df4d99893952fd1e9f","allowed_seeds":{"260701":"expected","260702":"expected","260703":"expected","260704":"expected","260705":"expected","260706":"expected","260707":"expected","260708":"expected","260709":"expected","260710":"expected","260711":"expected","260712":"expected","260713":"expected","260714":"expected","260715":"expected","260716":"expected","260717":"expected","260718":"expected","260719":"expected","260720":"expected","260721":"conservative","260722":"conservative","260723":"conservative","260724":"conservative","260725":"conservative","260726":"optimistic","260727":"optimistic","260728":"optimistic","260729":"optimistic","260730":"optimistic"},"max_users":2000,"users_per_db":2000,"users_per_arm":1000,"pairs_per_db":1000,"allowed_output_directory":"C:\\Users\\이소이\\Desktop\\[은평4기] AI로 끝내자! 바이브코딩으로 배우는 데이터분석 실전 과정\\미니 프로젝트\\깃허브 업로드용\\sesac-data-analysis-mini-project\\09_단계별 분석\\3단계_10000건_증감_분석\\호텔검색_1만명증강_승인인터페이스수정및교정_260907_1351_01\\calibration_dbs","overwrite":false,"production_execution_authorized":false,"production_seed":2434815518}
