{
  "allowed_mode": "calibration",
  "execution_manifest_path": "C:\\Users\\이소이\\Desktop\\[은평4기] AI로 끝내자! 바이브코딩으로 배우는 데이터분석 실전 과정\\미니 프로젝트\\깃허브 업로드용\\sesac-data-analysis-mini-project\\09_단계별 분석\\3단계_10000건_증감_분석\\호텔검색_1만명증강_결합전이개정및검증_260907_1418_01\\호텔검색_1만명증강_개발동결manifest_260907_1418_01.json",
  "execution_manifest_sha256": "775a5d928d83515d9caab4b06bb6d3cb8a7657b3e2f38d413bb50cd0cbc29f91",
  "allowed_config_sha256": [
    "391a5372303ef2399ac8bdc1b92872b9e0476c38ccb4b05673e022c0d9831b25"
  ],
  "reference_sha256": "9120561ee85705141a92eae74c5015fb2c9a20f0c8d1f6df4d99893952fd1e9f",
  "allowed_seeds": {
    "260800": "expected"
  },
  "max_users": 200,
  "users_per_db": 200,
  "users_per_arm": 100,
  "pairs_per_db": 100,
  "allowed_output_directory": "C:\\Users\\이소이\\Desktop\\[은평4기] AI로 끝내자! 바이브코딩으로 배우는 데이터분석 실전 과정\\미니 프로젝트\\깃허브 업로드용\\sesac-data-analysis-mini-project\\09_단계별 분석\\3단계_10000건_증감_분석\\호텔검색_1만명증강_결합전이개정및검증_260907_1418_01\\tests",
  "overwrite": false,
  "production_execution_authorized": false,
  "production_seed": 2434815518
}
