{
  "allowed_mode": "calibration",
  "execution_manifest_path": "C:\\Users\\이소이\\Desktop\\[은평4기] AI로 끝내자! 바이브코딩으로 배우는 데이터분석 실전 과정\\미니 프로젝트\\깃허브 업로드용\\sesac-data-analysis-mini-project\\09_단계별 분석\\3단계_10000건_증감_분석\\호텔검색_1만명증강_승인인터페이스수정및교정_260907_1351_01\\호텔검색_1만명증강_실행파일manifest_260907_1351_02.json",
  "execution_manifest_sha256": "6c570c979cc4c1e9889059ef70e990041d53b28520ce8168c0dbe400b8186415",
  "allowed_config_sha256": [
    "5db48c55eedaf2ae8850be0b529503182131e70a4259380ccad58ab4811a04e7"
  ],
  "reference_sha256": "9120561ee85705141a92eae74c5015fb2c9a20f0c8d1f6df4d99893952fd1e9f",
  "allowed_seeds": {
    "2026090711": "expected"
  },
  "max_users": 200,
  "users_per_db": 200,
  "users_per_arm": 100,
  "pairs_per_db": 100,
  "allowed_output_directory": "C:\\Users\\이소이\\Desktop\\[은평4기] AI로 끝내자! 바이브코딩으로 배우는 데이터분석 실전 과정\\미니 프로젝트\\깃허브 업로드용\\sesac-data-analysis-mini-project\\09_단계별 분석\\3단계_10000건_증감_분석\\호텔검색_1만명증강_승인인터페이스수정및교정_260907_1351_01\\tests",
  "overwrite": false,
  "production_execution_authorized": false,
  "production_seed": 2434815518
}
